<?xml version="1.0"?>
<!DOCTYPE template SYSTEM "../../../inc/page.dtd">
<template>
    <title>Document</title>
    <summary>A large text area with an extended document area at the
        bottom.</summary>
    <thumbnail>document.png</thumbnail>
    <style>page.css</style>
    <structure>
        <section>
            <name>text1</name>
            <type>text</type>
        </section>
        <section>
            <name>document1</name>
            <type>document</type>
        </section>
    </structure>
    <folders>
        <name>one-column</name>
        <name>no-image</name>
    </folders>
</template>
